finding,evidence,trust_level,why_trusted,scope_limit
thermal_mode=off remains the default/no-thermal route.,Patch-test report and current config.py default thermal mode are off.,high,Direct source-level default plus patch tests.,Thermal subproject only; original no-thermal project remains separate.
"thermal_mode=uniform, delta_T=0 matches no-thermal route in completed diagnostics.","A/B comparison tables report zero differences within table precision in micro, strong, and moderate diagnostics.",high,Repeated under smoke and full training schedules.,Same deterministic seed and tension route for diagnostic runs.
Prescribed +20 K thermal strain shifts reaction/stress downward in displacement-controlled tension.,Strong shift -29.6301441267 MPa; moderate probe shift -25.1530786045 MPa.,high,Checkpointed energy-conjugate reaction is available and used as primary metric.,"Tension diagnostics only, not shear or external validation."
Prescribed +20 K reduces notch-tip/high-threshold alpha growth in the moderate damage probe.,Moderate final alpha C 0.0781823396683 versus A 0.344652026892; alpha>=0.05 final Case C fraction 0.0293845869525.,medium,High-threshold/notch metrics were separated from low-level background diagnostics.,Single seed and prescribed-temperature only.
Checkpointed energy-conjugate reaction remains available and is the primary reaction.,"Micro, strong, and moderate reports state all steps have energy-conjugate reaction availability.",high,Postprocess tables and handoffs consistently use reaction_N_energy.,Requires saved step checkpoints.
No heat PDE or damage-dependent conductivity was implemented in this stage.,"Guard reports, PROJECT_MEMORY.md, and source scope show no heat residual, trainable temperature field, or k(d)=g(d)k0 coupling.",high,Multiple package guard checks agree with current source scope.,"This is a guard conclusion, not validation of future heat transport."
