file,function,formula,units_in,units_out,conversion_factor,could_explain_2x
compute_energy_mixed_tm.py,compute_mixed_tm_energy,E = sum(area_elem * elastic_energy_density) + sum(area_elem * fracture_energy_density),"area mm^2, energy density kN/mm^2",kN*mm,none inside energy; reaction uses dE/dDelta * 1000,No direct 1/2 factor; derivative of quadratic energy removes the strain-energy 1/2.
field_computation.py,FieldComputation.fieldCalculation,"top-u-free: u=Delta*raw_u*(eta+bubble), v=Delta*(eta+bubble*raw_v)",Delta mm; raw NN dimensionless,"u,v in mm",Delta multiplies both physical top vertical and learned horizontal/internal modes,"Potentially, but this package checks it with no-horizontal and pure-top-vertical modes."
history_field_mixed_tm.py / prior package boundary_force_metrics,_top_reaction_force_N / boundary_force_metrics,R_top = 1000 * sum(sigma_yy_tm_eff * top_edge_length * thickness_1mm),"stress kN/mm^2, edge length mm, unit thickness 1 mm",N,1000 kN-to-N,No obvious factor; this is a physical top-vertical traction integral only.
run_checkpointed_d0020_exact_reaction.py,exact dPi/dDelta,R = 1000 * autograd(d(Pi_total_kNmm)/dDelta_mm),kN*mm / mm,N,1000 kN-to-N,No unit conversion mismatch found; mismatch tracks the differentiated mode.
mixed_mode_tm.py,tm_source_effective_stress_fields,sigma_eff = sigma_total + (g_alpha - 1) * sigma_plus,"strain dimensionless, E kN/mm^2",kN/mm^2,none,"Not by itself; it defines current-stress postprocessing, while history energy can freeze active branches."
