metric_name,old_name,new_name,allowed_use,disallowed_use,reason,requires_warning_in_plots,historical_no_softening_conclusions_need_relabeling
energy exact reaction,exact dPi/dDelta,reaction_N_energy_exact,primary reaction and primary softening gate when checkpoint autograd is available,non-checkpointed runs without exact mechanics objective reconstruction,It is the derivative of the actual checkpoint mechanics objective with respect to Delta.,False,False
energy virtual-work reaction,R_virtual_energy_autograd_sigma_N,reaction_N_energy_virtual_work,validation-equivalent reaction when it matches reaction_N_energy_exact within tolerance,primary gate if exact comparison is unavailable or fails tolerance,It uses volume virtual work of energy-autograd stress and reproduces exact dPi/dDelta in the D0020 audit.,False,False
legacy top-boundary sigma reaction,reaction_N_tm_eff,reaction_N_legacy_top_sigma,legacy diagnostic and backward comparison only,"primary reaction, physical stress-strain reaction label, or primary softening gate",The stress field sigma_tm_eff is not conjugate to the checkpoint history mechanics energy.,True,True
legacy bottom-boundary sigma reaction,bottom_reaction_N,reaction_N_bottom_sigma_legacy,boundary diagnostic and sign/balance check,primary softening gate,It is based on legacy postprocessed stress rather than exact energy derivative.,True,False
internal cut force above crack,internal_cut_force_above_crack_N,reaction_N_internal_cut_above,internal-force diagnostic around the cracked region,primary reaction or physical validation,It is a local diagnostic cut force and not the global energy-conjugate reaction.,True,False
internal cut force below crack,internal_cut_force_below_crack_N,reaction_N_internal_cut_below,internal-force diagnostic around the cracked region,primary reaction or physical validation,It is a local diagnostic cut force and not the global energy-conjugate reaction.,True,False
